{
  "schemaVersion": "1.0.0",
  "id": "piko-52504",
  "manufacturer": "PIKO",
  "articleNumber": "52504",
  "releaseDate": "2024",
  "uvp": {
    "amount": 245.0,
    "currency": "EUR"
  },
  "model": {
    "country": "DE",
    "operator": "Privatbahn",
    "type": "NoHAB 1149 Altmark-Rail",
    "number": null,
    "livery": null,
    "scale": "H0",
    "electricSystem": "DC-Analog",
    "decoderInterface": "NEM 658 PluX22",
    "era": "VI",
    "luepMm": 218,
    "minRadiusMm": 358
  },
  "description": "Neuheit 2024: Die PIKO \"Rundnase\" in attraktiver Bedruckung der 1149 von Altmark-Rail in Epoche VI. Über Geschmack lässt sich trefflich streiten, es gibt jedoch Dinge, deren Eleganz über jeden Zweifel erhaben ist. Von der unbestrittenen Eleganz des Vorbilds dürfen auch die PIKO Modelle der NoHAB profitieren. Um diesen Gesamteindruck zu erreichen wurde grosser Wert auf Details gelegt. Die seitlichen Lüftungsgitter werden als stark gliedernde Elemente des Lokkastens mit feinen Ätzteilen ausgeführt und sind ein absoluter Blickfang. Aber auch die markanten stirnseitigen Scheiben sowie die seitlichen „Bullaugen“ tragen durch den perfekt bündigen Sitz zum hervorragenden Bild bei. Vollendet wird der Eindruck durch die präzise und hochdetaillierte Gestaltung der Drehgestelle. Als Antrieb dient ein kräftiger und laufruhiger Motor mit zwei Schwungmassen. Das Modell ist dank PluX22-Schnittstelle und ausreichend Platz auf der aufgeräumten Platine für die einfache Nachrüstung eines Decoders und Sound vorbereitet.",
  "categories": [
    "lokomotive",
    "diesellokomotive"
  ],
  "tags": [
    "piko-neuheiten-2024"
  ],
  "source": {
    "url": "https://www.piko-shop.de/de/artikel/diesellok-nohab-1149-altmark-rail-vi-41322.html",
    "notes": "Daten von der Webseite, automatisch geupdated.",
    "imageUrl": "https://www.piko-shop.de/media/oart_0/oart_d/oart_41322/thumbs/51741_446025.jpg"
  },
  "updatedAt": "2026-10-10T19:52:11Z"
}
