{
  "schemaVersion": "1.0.0",
  "id": "piko-57566",
  "manufacturer": "PIKO",
  "articleNumber": "57566",
  "releaseDate": null,
  "uvp": {
    "amount": 293.0,
    "currency": "EUR"
  },
  "model": {
    "country": "AT",
    "operator": "ÖBB",
    "type": "BR 55",
    "number": null,
    "livery": "(G7.1)",
    "scale": "H0",
    "electricSystem": "DC-Digital",
    "decoderInterface": "NEM 658 PluX22",
    "era": "III",
    "luepMm": 193,
    "minRadiusMm": 358
  },
  "description": "Neuheit 2025: Schlepptenderlokomotive G7.1 der ÖBB in Epoche III. Das Modell verfügt ab Werk über einen passenden PSD XP Digitaldecoder.",
  "categories": [
    "lokomotive",
    "dampflokomotive"
  ],
  "tags": [
    "piko-neuheiten-2025"
  ],
  "source": {
    "url": "https://www.piko-shop.de/de/artikel/sound-schlepptenderlok-br-55-g7.1-oebb-iii,-inkl.-piko-sound-decoder-44913.html",
    "notes": "Daten von der Webseite, automatisch geupdated.",
    "imageUrl": "https://www.piko-shop.de/media/oart_0/oart_s/oart_44913/thumbs/54565_432010.jpg"
  },
  "updatedAt": "2026-10-10T19:52:11Z"
}
