{
  "schemaVersion": "1.0.0",
  "id": "piko-52550",
  "manufacturer": "PIKO",
  "articleNumber": "52550",
  "releaseDate": "2018",
  "uvp": {
    "amount": 164.0,
    "currency": "EUR"
  },
  "model": {
    "country": "DE",
    "operator": "PIKO",
    "type": "V 23",
    "number": null,
    "livery": "PIKO Kreisel-Lok",
    "scale": "H0",
    "electricSystem": "DC-Analog",
    "decoderInterface": "NEM 658 PluX22",
    "era": "V",
    "luepMm": 80,
    "minRadiusMm": 358
  },
  "description": "Sonneberg ist um eine Attraktion reicher. Ab 2017 ziert eine ehemalige Rangierlokomotive der DR in attraktiver Farbgebung den als PIKO Kreisel bezeichneten Kreisverkehr an der Zufahrt zum Firmengelände. Das PIKO Modell der Baureihe V23 \"Kreisel-Lok\" ist eine universell verwendbare Lok, die sich für den Rangier- und Streckendienst eignet und in der auffälligen Sonderlackierung in keiner Sammlung fehlen darf. Das PIKO Modell zeichnet sich durch vorzügliche Laufeigenschaften bei niedrigen Geschwindigkeiten aus und kann so auf der Modellbahn zum Beispiel auch vor Sonderzügen oder auf Anschlussgleisen eingesetzt werden. Dazu besitzt der kräftige Motor eine präzise ausgewuchtete Schwungmasse. Da Rahmen, Getriebegehäuse und Motorvorbau aus Zinkdruckguss bestehen, ist das kompakte Modell zugkräftig, robust und grifffest, ohne auf Details verzichten zu müssen. Das Modell besitzt Kurzkupplungskinematik und einen digital schaltbaren fahrtrichtungsabhängigen Lichtwechsel weiss/rot. Das Modell ist für die Nachrüstung mit einem Digital- oder PIKO Sound-Decoder vorbereitet.",
  "categories": [
    "lokomotive",
    "diesellokomotive"
  ],
  "tags": [
    "piko-neuheiten-2018"
  ],
  "source": {
    "url": "https://www.piko-shop.de/de/artikel/diesellok-v-23-piko-kreisel-lok-23410.html",
    "notes": "Daten von der Webseite, automatisch geupdated.",
    "imageUrl": "https://www.piko-shop.de/media/oart_0/oart_d/oart_23410/thumbs/21689_407078.jpg"
  },
  "updatedAt": "2026-10-10T19:52:11Z"
}
