{
  "schemaVersion": "1.0.0",
  "id": "piko-59515",
  "manufacturer": "PIKO",
  "articleNumber": "59515",
  "releaseDate": "2024",
  "uvp": {
    "amount": 269.0,
    "currency": "EUR"
  },
  "model": {
    "country": "DE",
    "operator": "Privatbahn",
    "type": "BR 442",
    "number": null,
    "livery": "Talent 2",
    "scale": "H0",
    "electricSystem": "DC-Digital",
    "decoderInterface": "NEM 652",
    "era": "VI",
    "luepMm": 636,
    "minRadiusMm": 358
  },
  "description": "Neuheit 2024: Druckvariante des dreiteiligen Elektrotriebzuges BR 442 \"Talent 2\" im attraktiven Design der Luther-Müntzer-Bahn von Abellio in Epoche VI. Eine Digitalschnittstelle nach NEM 652 ermöglicht den unkomplizierten Einbau eines passenden Decoders. Das Modell ist zudem für die Nachrüstung mit Sound mit grösstmöglichem Lautsprecher vorbereitet.",
  "categories": [
    "lokomotive",
    "triebzug"
  ],
  "tags": [
    "piko-neuheiten-2024"
  ],
  "source": {
    "url": "https://www.piko-shop.de/de/artikel/elektrotriebwagen-br-442-talent-2-abellio-vi-3-tlg.-41556.html",
    "notes": "Daten von der Webseite, automatisch geupdated.",
    "imageUrl": "https://www.piko-shop.de/media/oart_0/oart_e/oart_41556/thumbs/53457_428674.jpg"
  },
  "updatedAt": "2026-10-10T19:52:11Z"
}
