{
  "schemaVersion": "1.0.0",
  "id": "piko-59744",
  "manufacturer": "PIKO",
  "articleNumber": "59744",
  "releaseDate": "2018",
  "uvp": {
    "amount": 179.0,
    "currency": "EUR"
  },
  "model": {
    "country": "DD",
    "operator": "DR",
    "type": "BR 130",
    "number": null,
    "livery": "Widerstandsbremse",
    "scale": "H0",
    "electricSystem": "DC-Analog",
    "decoderInterface": "NEM 658 PluX22",
    "era": "IV",
    "luepMm": 237,
    "minRadiusMm": 358
  },
  "description": "Formneuheit, bei dem Modell sind die Änderungen mit den grossen Dachlüftern für die Widerstandsbremse berücksichtigt.",
  "categories": [
    "lokomotive",
    "diesellokomotive"
  ],
  "tags": [
    "piko-neuheiten-2018"
  ],
  "source": {
    "url": "https://www.piko-shop.de/de/artikel/diesellok-br-130-dr-iv-mit-widerstandsbremse-16810.html",
    "notes": "Daten von der Webseite, automatisch geupdated.",
    "imageUrl": "https://www.piko-shop.de/media/oart_0/oart_d/oart_16810/thumbs/53359_404322.jpg"
  },
  "updatedAt": "2026-10-10T19:52:11Z"
}
