{
  "schemaVersion": "1.0.0",
  "id": "roco-7100036",
  "manufacturer": "Roco",
  "articleNumber": "7100036",
  "releaseDate": "Frühling 2026",
  "uvp": {
    "amount": 209.9,
    "currency": "EUR"
  },
  "model": {
    "country": "DE",
    "operator": "K.Bay.Sts.B.",
    "type": "Gattung PtL 2/2",
    "number": null,
    "livery": null,
    "scale": "H0",
    "electricSystem": "DC-Analog",
    "era": "I",
    "luepMm": 80,
    "minRadiusMm": 358,
    "decoderInterface": "Elektrische Schnittstelle für Triebfahrzeuge nach NEM 652 mit Steckvorrichtung"
  },
  "description": "Dampflokomotive Gattung PtL 2/2 „Glaskasten“ der Königlich Bayerischen Staats-Eisenbahnen. Authentische Lackierung mit feinen Zierlinien .  Einsatz vor Personen- und leichten Güterzügen auf Nebenbahnen Die Lokalbahnlokomotive mit der Gattungsbezeichnung PtL 2/2 (Personenzug-Tenderlokomotive für Lokalbahnen) ist bei Eisenbahnfreunden sicher eine der bekanntesten Dampflokomotiven aus der alten Zeit. Der Volksmund nannte sie: Glaskastl, Schnauferle, Quietscherle, Bockl usw. Ihre Leistung war mit 210 PS angegeben. 40 km/h durften sie fahren – liefen aber nach Berichten von Lokomotivführern 60 km/h und mehr.",
  "categories": [
    "lokomotive",
    "dampflokomotive"
  ],
  "tags": [
    "roco-neuheiten-2026",
    "H0"
  ],
  "source": {
    "url": "https://www.roco.cc/rde/home-neuheiten/7100036-dampflokomotive-gattung-ptl-22-kbaystsb.html",
    "notes": "Daten von der Webseite, automatisch geupdated.",
    "imageUrl": "https://www.roco.cc/media/catalog/product/cache/7ee44aa0126bc9176198779df8fa359f/2/6/264603.jpg"
  },
  "updatedAt": "2026-05-05T21:19:47Z"
}
