{
  "schemaVersion": "1.0.0",
  "id": "piko-21046",
  "manufacturer": "PIKO",
  "articleNumber": "21046",
  "releaseDate": "2026",
  "uvp": {
    "amount": 349.0,
    "currency": "EUR"
  },
  "model": {
    "country": "AT",
    "operator": "ÖBB",
    "type": "Rh",
    "number": "1067",
    "livery": null,
    "scale": "H0",
    "electricSystem": "AC-Digital",
    "decoderInterface": "NEM 658 PluX22",
    "era": "IV",
    "luepMm": 121,
    "minRadiusMm": 358
  },
  "description": "Neuheit 2026: Mit der Reihe 1067 waren für die ÖBB zwischen 1961 und 1994 wahre Exoten im Einsatz. Von diesen elektrischen Lokomotiven wurden lediglich ein Prototyp und vier weitere Maschinen hergestellt. Sie waren mit einer technischen Besonderheit ausgestattet: einem elektrohydraulischen Antrieb. Die von den Jenbacher Werken gebauten Elektrolokomotiven mit Mittelführerstand wurden im Verschubdienst eingesetzt und konnten in tannengrüner oder blutoranger Ausführung angetroffen werden. Das stark an Diesellokomotiven angelehnte Antriebskonzept erwies sich als anfällig für Defekte und Schäden, weshalb die Produktion nicht fortgesetzt und die Lokomotive 1067.03 als letztes aktives Exemplar am 1. Oktober 1994 ausser Dienst gestellt wurde. Heute können noch zwei der Fahrzeuge in den Eisenbahnmuseen Knittelfeld und Ampflwang bewundert werden.\n\nFeingliedriger Scherenstromabnehmer aus Metall, ohne sichtbare Verschraubung\nDetailliert nachgebildete Kühlanlage im Vorbau mit freistehendem Lüfterrad\nDetailliertes Fahrwerk mit zahlreichen Anbauteilen\nDreilicht-Spitzensignal mit roten Schlussleuchten, im Analogbetrieb mit der Fahrtrichtung wechselnd und im Digitalbetrieb schaltbar\nFührerpultbeleuchtung; Analog bei Fahrbetrieb ein, sonst digital schaltbar\nZusätzliche digitale Lichtfunktionen, wie Rangiersignal und wahlweise abschaltbarer Stirn- und Schlussbeleuchtung\nDigitale Soundversionen mit zahlreichen, fahrzeugtypischen Sounds\nGrundplatte mit Gleisnachbildung und passende Zurüstteile, wie Bremsleitungen, Kuppelhaken und Kupplungsabdeckung, für die Präsentation in der Vitrine",
  "categories": [
    "lokomotive",
    "elektrolokomotive"
  ],
  "tags": [
    "piko-neuheiten-2026"
  ],
  "source": {
    "url": "https://www.piko-shop.de/de/artikel/sound-e-lok-rh-1067-oebb-iv-wechselstromversion,-inkl.-piko-sound-decoder-49121.html",
    "notes": "Daten von der Webseite, automatisch geupdated.",
    "imageUrl": "https://www.piko-shop.de/media/oart_0/oart_s/oart_49121/thumbs/61122_538642.jpg"
  },
  "updatedAt": "2026-10-10T19:52:11Z"
}
