{
  "schemaVersion": "1.0.0",
  "id": "piko-21830",
  "manufacturer": "PIKO",
  "articleNumber": "21830",
  "releaseDate": "2026",
  "uvp": {
    "amount": 225.0,
    "currency": "EUR"
  },
  "model": {
    "country": "DE",
    "operator": "Privatbahn",
    "type": "BR 193",
    "number": "7193",
    "livery": "Medway",
    "scale": "H0",
    "electricSystem": "DC-Analog",
    "decoderInterface": "NEM 658 PluX22",
    "era": "VI",
    "luepMm": 218,
    "minRadiusMm": 358
  },
  "description": "Neuheit 2026: Druckvariante des Vectron im markanten Design von Medway in der Epoche VI. Die Elektrolok verfügt über eine PluX22-Schnittstelle und ist für die unkomplizierte Nachrüstung mit Sound und grösstmöglichem Lautsprecher vorbereitet.",
  "categories": [
    "lokomotive",
    "elektrolokomotive"
  ],
  "tags": [
    "piko-neuheiten-2026"
  ],
  "source": {
    "url": "https://www.piko-shop.de/de/artikel/elektrolok-vectron-br-7193-medway-vi-49412.html",
    "notes": "Daten von der Webseite, automatisch geupdated.",
    "imageUrl": "https://www.piko-shop.de/media/oart_0/oart_e/oart_49412/thumbs/59529_526573.jpg"
  },
  "updatedAt": "2026-10-10T19:52:11Z"
}
