{
  "schemaVersion": "1.0.0",
  "id": "roco-71948",
  "manufacturer": "Roco",
  "articleNumber": "71948",
  "releaseDate": "2021",
  "uvp": null,
  "model": {
    "country": "CH",
    "operator": "SBB",
    "type": "193",
    "number": "525-3",
    "livery": null,
    "scale": "H0",
    "electricSystem": "DC-Analog",
    "decoderInterface": "Elektrische Schnittstelle für Triebfahrzeuge PluX22",
    "era": "VI",
    "luepMm": 218,
    "minRadiusMm": 358
  },
  "description": "Elektrolokomotive 193 525 der SBB Cargo International.LED-Spitzenbeleuchtung mit der Fahrtrichtung wechselnd (3x weiss vorne, 1x weiss hinten). Im Digitalbetrieb sind Lichtfunktionen nach Schweizer Vorbild schaltbar.■ Ausführung mit Taufnamen „Rotterdam“■ Vorbildgerecht mit langer Regenrinne und hohen Führerständen für den Einsatz in Italien■ Freistehende Griffstangen, teilweise aus Metall■ In Kooperation mit Railcolor Design2019 hat SBB Cargo International in Zusammenarbeit mit der SüdLeasing GmbH 20 Vectron-Lokomotiven bei Siemens Mobility bestellt. Die Maschinen verfügen über eine Ausrüstung für Einsätze in Deutschland, Österreich, Schweiz, Italien und den Niederlanden (DACHINL).Zur Feier der Eröffnung des Büros in den Niederlanden erhielt eine Maschine ein besonderes Design. Unter Eisenbahnfreunden wird die Lok „Hollandpiercer‟ genannt.",
  "categories": [
    "lokomotive",
    "elektrolokomotive"
  ],
  "tags": [
    "roco-neuheiten-2021"
  ],
  "source": {
    "url": "https://www.roco.cc/rde/produkte/lokomotiven/elektrolokomotiven/71948-elektrolokomotive-193-525-3-sbb-cargo-international.html",
    "notes": "Daten von der Webseite, automatisch geupdated.",
    "imageUrl": "https://www.roco.cc/media/catalog/product/cache/7ee44aa0126bc9176198779df8fa359f/2/4/247109.jpg"
  },
  "updatedAt": "2026-10-16T13:05:01Z"
}
