{
  "schemaVersion": "1.0.0",
  "id": "roco-7500168",
  "manufacturer": "Roco",
  "articleNumber": "7500168",
  "releaseDate": "2026",
  "uvp": {
    "amount": 249.9,
    "currency": "EUR"
  },
  "model": {
    "country": "FR",
    "operator": "SNCF",
    "type": "BB 26005",
    "number": null,
    "livery": "SNCF",
    "scale": "H0",
    "electricSystem": "DC-Analog",
    "era": "VI",
    "luepMm": 204,
    "minRadiusMm": 358,
    "decoderInterface": "Elektrische Schnittstelle für Triebfahrzeuge PluX22"
  },
  "description": "Roco Neuheiten 2026: Elektrolokomotive, BB 26005, SNCF. „Trains Spéciaux“-Design. Feine Ätzteile am Dach. Filigrane Ausführung der beiden unterschiedlichen Stromabnehmer. Im Digitalbetrieb Spitzenlicht nach französischem Vorbild schaltbar. und Führerstandsbeleuchtung. Front mit zusätzlicher Anschluss-Dose für Wendezug-Steuerung. Version im silber-grauen Multiservice-Design. Vorbildgerechte Dachausführung mit allen Details. „Trains Spéciaux“ ist ein von SNCF Voyageurs angebotener Service, der. es ermöglicht, einen Personenzug teilweise oder vollständig zu reservieren. Um die Lokomotiven zu kennzeichnen, die für die Traktion dieser Sonder -. züge eingesetzt werden, hat SNCF Voyageurs beschlossen, einigen Sybic-. Lokomotiven ein neues Farbkleid zu verpassen. Sie harmoniert perfekt mit.",
  "categories": [
    "lokomotive",
    "elektrolokomotive"
  ],
  "tags": [
    "roco-neuheiten-2026",
    "H0"
  ],
  "source": {
    "url": "https://www.roco.cc/rde/produkte/lokomotiven/elektrolokomotiven/7500168-elektrolokomotive-bb-26005-sncf.html",
    "notes": "Daten von der Webseite, automatisch geupdated.",
    "imageUrl": "https://www.roco.cc/media/catalog/product/cache/7ee44aa0126bc9176198779df8fa359f/2/6/264642.jpg"
  },
  "updatedAt": "2026-05-05T21:48:40Z"
}
