{
  "schemaVersion": "1.0.0",
  "id": "piko-52369",
  "manufacturer": "PIKO",
  "articleNumber": "52369",
  "releaseDate": null,
  "uvp": {
    "amount": 359.0,
    "currency": "EUR"
  },
  "model": {
    "country": "LU",
    "operator": "CFL",
    "type": "DE18 CFL",
    "number": null,
    "livery": null,
    "scale": "H0",
    "electricSystem": "AC-Digital",
    "decoderInterface": "NEM 658 PluX22",
    "era": "VI",
    "luepMm": 196,
    "minRadiusMm": 358
  },
  "description": "Neuheit 2025: Diesellok DE 18 der CFL in Epoche VI. Das Modell gibt Proportionen, Beschriftung und das charakteristische vorbildgerechte Dekor wieder und berücksichtigt zudem die baulichen Besonderheiten der CFL Maschine. Ein starker Motor treibt über zwei Kardanwellen alle vier Radsätze des Modells an. Das Modell besitzt ab Werk einen passenden PSD XP Sound-Decoder mit grossem Lautsprecher und begeistert mit vielfältigen Digital- und Sound-Funktionen. Das Modell trägt das Gütezeichen fits mfx®. Um Digitaldecoder für alle Nutzer der aktuellen Märklin Digitalzentralen zuverlässig einsetzbar zu machen, wurde gemeinsam mit Märklin und anderen Herstellern ein neues Gütezeichen „fits mfx®“ eingeführt. Dieses kann nur von Digitaldecodern verwendet werden, die einen speziellen mfx®-Test durchlaufen und vollumfänglich bestanden haben. Diese Decoder und auch die Lokomotiven in denen sie verbaut sind, tragen das Gütezeichen „fits mfx®“, welches die uneingeschränkte mfx® Funktionalität zertifiziert. Das bedeutet, dass nunmehr auch PIKO Produkte mit dem „fits mfx®“ Logo die vielfältigen Funktionen von mfx® vollständig unterstützen.",
  "categories": [
    "lokomotive",
    "diesellokomotive"
  ],
  "tags": [
    "piko-neuheiten-2025"
  ],
  "source": {
    "url": "https://www.piko-shop.de/de/artikel/sound-diesellok-de18-cfl-vi-wechselstromversion,-inkl.-piko-sound-decoder-45170.html",
    "notes": "Daten von der Webseite, automatisch geupdated.",
    "imageUrl": "https://www.piko-shop.de/media/oart_0/oart_s/oart_45170/thumbs/58001_508703.jpg"
  },
  "updatedAt": "2026-10-10T19:52:11Z"
}
