{
  "schemaVersion": "1.0.0",
  "id": "piko-52337",
  "manufacturer": "PIKO",
  "articleNumber": "52337",
  "releaseDate": "2025",
  "uvp": {
    "amount": 305.0,
    "currency": "EUR"
  },
  "model": {
    "country": "DE",
    "operator": "DB",
    "type": "BR 213",
    "number": null,
    "livery": "orientrot",
    "scale": "H0",
    "electricSystem": "DC-Digital",
    "decoderInterface": "NEM 658 PluX22",
    "era": "V",
    "luepMm": 139,
    "minRadiusMm": 358
  },
  "description": "Neuheit 2025: Die schlichten Lokomotiven der Baureihe V 100 waren massgeblich beteiligt am Verschwinden von Dampflokomotiven auf Nebenbahnen. Das Haupteinsatzgebiet der ab 1961 in Serie gelieferten Maschinen der BR V 100.10 und .20 lag im leichten Reise- und Güterzugdienst. 1968 wurden die Loks als Baureihe 211 in das neue Nummernschema der Deutschen Bundesbahn eingeordnet. Die leistungsstärkeren Varianten der Baureihe V 100.20 verrichteten auch auf Haupt- und Steilstrecken ihren Dienst.\n\nFormvariante\nDigital schaltbare Führerstandbeleuchtung\nDetaillierte Einrichtung des Mittelführerstandes\nFein geätzte Lüftergitter\nFreistehende Hand- und Griffstangen\nKühlanlage mit frei drehbarem Lüfterrad\nPIKO TrainSound® onboard",
  "categories": [
    "lokomotive",
    "diesellokomotive"
  ],
  "tags": [
    "piko-neuheiten-2026",
    "piko-neuheiten-2025-2-halbjahr"
  ],
  "source": {
    "url": "https://www.piko-shop.de/de/artikel/sound-diesellok-br-213-orientrot-db-ag-v,-inkl.-piko-sound-decoder-45734.html",
    "notes": "Daten von der Webseite, automatisch geupdated.",
    "imageUrl": "https://www.piko-shop.de/media/oart_0/oart_s/oart_45734/thumbs/58875_517875.jpg"
  },
  "updatedAt": "2026-10-10T19:52:11Z"
}
