{
  "schemaVersion": "1.0.0",
  "id": "roco-79286",
  "manufacturer": "Roco",
  "articleNumber": "79286",
  "releaseDate": "2019",
  "uvp": null,
  "model": {
    "country": "CH",
    "operator": "SBB",
    "type": "Re 460",
    "number": null,
    "livery": null,
    "scale": "H0",
    "electricSystem": "AC-Digital",
    "decoderInterface": "Elektrische Schnittstelle für Triebfahrzeuge PluX22",
    "era": "VI",
    "luepMm": 212,
    "minRadiusMm": 358
  },
  "description": "Elektrolokomotive Reihe 460 der Schweizerischen Bundesbahnen, Epoche VI.Motor mit Schwungmasse.",
  "categories": [
    "lokomotive",
    "elektrolokomotive"
  ],
  "tags": [
    "roco-neuheiten-2019"
  ],
  "source": {
    "url": "https://www.roco.cc/rde/produkte/lokomotiven/79286-elektrolokomotive-re-460-sbb.html",
    "notes": "Daten von der Webseite, automatisch geupdated.",
    "imageUrl": "https://www.roco.cc/media/catalog/product/cache/7ee44aa0126bc9176198779df8fa359f/2/3/237131.jpg"
  },
  "updatedAt": "2026-10-11T10:43:56Z"
}
