{
  "schemaVersion": "1.0.0",
  "id": "piko-52989",
  "manufacturer": "PIKO",
  "articleNumber": "52989",
  "releaseDate": null,
  "uvp": {
    "amount": 209.0,
    "currency": "EUR"
  },
  "model": {
    "country": "NL",
    "operator": "NS",
    "type": "Rh 2200",
    "number": null,
    "livery": null,
    "scale": "H0",
    "electricSystem": "DC-Analog",
    "decoderInterface": "NEM 658 PluX22",
    "era": "IV",
    "luepMm": 150,
    "minRadiusMm": 358
  },
  "description": "Neuheit 2025: Druckvariante der Rh 2200 der NS in Epoche IV. Das Modell besticht durch feinste Gehäuse-Gravuren und Detaildarstellungen der schweren Drehgestelle amerikanischer Bauform mit vielen extra angesetzten Teilen. Die Geländer sind filigran und freistehend ausgeführt. Weitere Besonderheiten stellen der freie Führerhausdurchblick und die digital schaltbare Führerstandsbeleuchtung dar. Die Lokomotive ist ab Werk mit einer PluX22-Schnittstelle ausgerüstet, welche das Digitalisieren für jeden Modellbahnliebhaber zum Kinderspiel macht. Genauso leicht fällt die Nachrüstung eines Sounddecoders und eines Lautsprechers mit maximaler Membranfläche, die in Kombination für ein optimales Klangerlebnis sorgen.",
  "categories": [
    "lokomotive",
    "diesellokomotive"
  ],
  "tags": [
    "piko-neuheiten-2025"
  ],
  "source": {
    "url": "https://www.piko-shop.de/de/artikel/diesellok-rh-2200-ns-iv-45165.html",
    "notes": "Daten von der Webseite, automatisch geupdated.",
    "imageUrl": "https://www.piko-shop.de/media/oart_0/oart_d/oart_45165/thumbs/56450_441272.jpg"
  },
  "updatedAt": "2026-10-11T10:06:50Z"
}
