{
  "schemaVersion": "1.0.0",
  "id": "piko-52100",
  "manufacturer": "PIKO",
  "articleNumber": "52100",
  "releaseDate": "2025",
  "uvp": {
    "amount": 195.0,
    "currency": "EUR"
  },
  "model": {
    "country": "DK",
    "operator": "Privatbahn",
    "type": "BR 211",
    "number": null,
    "livery": "VLTJ",
    "scale": "H0",
    "electricSystem": "DC-Analog",
    "decoderInterface": "NEM 658 PluX22",
    "era": "V",
    "luepMm": 141,
    "minRadiusMm": 358
  },
  "description": "Neuheit 2025: Die schlichten Lokomotiven der Baureihe V 100 waren massgeblich beteiligt am Verschwinden von Dampflokomotiven auf Nebenbahnen. Das Haupteinsatzgebiet der ab 1961 in Serie gelieferten Maschinen der BR V 100.10 und .20 lag im leichten Reise- und Güterzugdienst. 1968 wurden die Loks als Baureihe 211 in das neue Nummernschema der Deutschen Bundesbahn eingeordnet. Die leistungsstärkeren Varianten der Baureihe V 100.20 verrichteten auch auf Haupt- und Steilstrecken ihren Dienst.\n\nDigitale Schaltung der Führerstandbeleuchtung durch Nachrüstung eines Digitaldecoders\nDetaillierte Einrichtung des Mittelführerstandes\nFein geätzte Lüftergitter\nFreistehende Hand- und Griffstangen\nKühlanlage mit frei drehbarem Lüfterrad",
  "categories": [
    "lokomotive",
    "diesellokomotive"
  ],
  "tags": [
    "piko-neuheiten-2026",
    "piko-neuheiten-2025-2-halbjahr"
  ],
  "source": {
    "url": "https://www.piko-shop.de/de/artikel/diesellok-br-211-vltj-v-45861.html",
    "notes": "Daten von der Webseite, automatisch geupdated.",
    "imageUrl": "https://www.piko-shop.de/media/oart_0/oart_d/oart_45861/thumbs/58776_517337.jpg"
  },
  "updatedAt": "2026-10-10T19:52:11Z"
}
