{
  "schemaVersion": "1.0.0",
  "id": "roco-7100023",
  "manufacturer": "Roco",
  "articleNumber": "7100023",
  "releaseDate": "Herbst 2025",
  "uvp": {
    "amount": 379.9,
    "currency": "EUR"
  },
  "model": {
    "country": "DD",
    "operator": "DR",
    "type": "BR 35",
    "number": "10",
    "livery": null,
    "scale": "H0",
    "electricSystem": "DC-Analog",
    "decoderInterface": "Elektrische Schnittstelle für Triebfahrzeuge PluX16",
    "era": "IV",
    "luepMm": 261,
    "minRadiusMm": 358
  },
  "description": "Dampflokomotive Baureihe 35.10 der Deutschen Reichsbahn.Antrieb auf zwei Achsen des Tenders und über Kardanwelle auf alle drei Treibachsen der Lok. Betriebszustand: 1970er Jahre. Einsatz überwiegend vor Schnell- und Eilzügen auf Hauptbahnen. Fein detailliert ausgeführtes Modell mit vielen separat angesetzten Steckteilen. Mit feinen Metallradsätzen. Beheimatung Rbd Dresden, Bw NossenMit der Einführung der EDV-Nummerierung bei der Deutschen Reichsbahn erhielten auch die, vormals als Baureihe 23.10 bezeichneten Lokomotiven, die neue Reihenbezeichnung 35.10. Die Lokomotiven waren ein Entwicklungsergebnis aus den beiden Vorserienlokomotiven 23 001 und 23 002. Die Lokomotiven der Baureihe 35.10 waren vor allem wegen des niedrigen Kohleverbrauchs und des ruhigen Laufs beim Betriebspersonal sehr beliebt.",
  "categories": [
    "lokomotive",
    "dampflokomotive"
  ],
  "tags": [
    "H0"
  ],
  "source": {
    "url": "https://www.roco.cc/rde/produkte/lokomotiven/dampflokomotiven/7100023-dampflokomotive-br-3510-dr.html",
    "notes": "Daten von der Webseite, automatisch geupdated.",
    "imageUrl": "https://www.roco.cc/media/catalog/product/cache/7ee44aa0126bc9176198779df8fa359f/2/5/259147.jpg"
  },
  "updatedAt": "2026-05-06T20:26:01Z"
}
