{
  "schemaVersion": "1.0.0",
  "id": "roco-78667",
  "manufacturer": "Roco",
  "articleNumber": "78667",
  "releaseDate": "2020",
  "uvp": null,
  "model": {
    "country": "AT",
    "operator": "ÖBB",
    "type": "Rh 1116",
    "number": "200-7",
    "livery": "Demokratie in Bewegung",
    "scale": "H0",
    "electricSystem": "AC-Digital",
    "decoderInterface": "Elektrische Schnittstelle für Triebfahrzeuge PluX22",
    "era": "VI",
    "luepMm": 221,
    "minRadiusMm": 358
  },
  "description": "Elektrolokomotive 1116 200 der Österreichischen Bundesbahnen in „Demokratie in Bewegung“ Werbe-Lackierung, Epoche VI.",
  "categories": [
    "lokomotive",
    "elektrolokomotive"
  ],
  "tags": [
    "roco-neuheiten-2020"
  ],
  "source": {
    "url": "https://www.roco.cc/rde/produkte/lokomotiven/elektrolokomotiven/78667-elektrolokomotive-1116-200-7-demokratie-in-bewegung-obb.html",
    "notes": "Daten von der Webseite, automatisch geupdated.",
    "imageUrl": "https://www.roco.cc/media/catalog/product/cache/7ee44aa0126bc9176198779df8fa359f/2/4/246028.jpg"
  },
  "updatedAt": "2026-10-11T12:15:12Z"
}
